{
  "schemaVersion": "2026-06-05.research.deep-research-retrieval-plan.v1",
  "planningInvocationId": "deep_research_retrieval_plan_inv_001",
  "principal": {
    "principalId": "research_worker_service",
    "role": "SERVICE",
    "subjectType": "SERVICE",
    "entryPoint": "AGENT_INTERNAL",
    "scopes": ["AGENT_COMMAND_SUBMIT", "RESEARCH_READ", "KNOWLEDGE_PRIVATE_READ"],
    "sessionId": "research_worker_session_001"
  },
  "workerLifecycle": {
    "schemaVersion": "2026-06-05.research.deep-research-worker-lifecycle-recorded.v1",
    "runtimeId": "research_deep_research_worker_lifecycle_runtime",
    "status": "CLAIMED_FOR_ASYNC_EXECUTION",
    "job": {
      "taskId": "agent_task_research_deep_001",
      "contextRef": "shared_ctx_research_deep_001",
      "jobId": "deep_research_job_001",
      "queueName": "research_deep_research"
    },
    "approval": {
      "approvalId": "deep_research_approval_001",
      "approvalRecordRef": "evidence:human-approval:deep-research-job-001",
      "reviewerPrincipalId": "teacher_001",
      "decision": "APPROVED_FOR_ASYNC"
    },
    "worker": {
      "workerId": "local_research_worker_001",
      "nodeType": "LOCAL",
      "capabilityKinds": ["RAG_RETRIEVAL", "MODEL_REASONING"]
    },
    "lifecycle": {
      "toStatus": "CLAIMED"
    },
    "boundary": {
      "approvalVerified": true,
      "workerClaimRecorded": true,
      "executionStarted": false,
      "ragRetrievalStarted": false,
      "externalModelCallStarted": false,
      "finalAnswerGenerated": false,
      "requiresFutureExecutionSlice": true
    }
  },
  "sourcePolicy": {
    "allowedClassifications": ["PUBLIC", "PRIVATE"],
    "includeStudentArchive": false,
    "includeRemoteDeviceSources": false,
    "directDatabaseAccessAllowed": false,
    "knowledgeBaseRefs": ["public_curriculum_knowledge", "private_research_notes"]
  },
  "retrievalPolicy": {
    "planningOnly": true,
    "executeRetrievalNow": false,
    "directoryIndexFirst": true,
    "vectorSearchNow": false,
    "externalModelCallNow": false,
    "ragSynthesisNow": false,
    "finalAnswerNowAllowed": false,
    "citationRequired": true,
    "sourceHashRequired": true
  },
  "researchQuestion": "如何基于学生学习档案构建个性化辅导助手并验证教学效果？",
  "objectives": [
    "定位公开教育研究证据",
    "定位本地私密研究笔记",
    "为后续 RAG 执行提供引用约束"
  ],
  "sourcePlan": [
    {
      "planItemId": "plan_public_directory_first",
      "knowledgeBaseRef": "public_curriculum_knowledge",
      "classification": "PUBLIC",
      "retrievalMode": "DIRECTORY_THEN_VECTOR",
      "plannedQuery": "个性化学习 档案 辅导 效果评估",
      "directoryScopeRefs": ["directory:education-ai", "directory:learning-analytics"],
      "maxChunks": 16,
      "maxSourceRefs": 6,
      "citationRequired": true,
      "sourceHashRequired": true
    },
    {
      "planItemId": "plan_private_notes",
      "knowledgeBaseRef": "private_research_notes",
      "classification": "PRIVATE",
      "retrievalMode": "DIRECTORY_THEN_VECTOR",
      "plannedQuery": "智能教研助手 学生档案 个性化题库 辅导助手",
      "directoryScopeRefs": ["directory:private-project-notes"],
      "maxChunks": 12,
      "maxSourceRefs": 4,
      "citationRequired": true,
      "sourceHashRequired": true
    }
  ],
  "budget": {
    "maxPlannedQueries": 4,
    "maxRetrievedChunks": 40,
    "maxSourceRefs": 12,
    "p99PlanningBudgetMs": 50
  },
  "evidenceRefs": [
    "evidence:deep-research-intent:job-001",
    "evidence:worker-lifecycle:job-001"
  ],
  "idempotencyKey": "deep-research-retrieval-plan:job-001"
}
